{
  "schema": 1,
  "name": "neubrutalism-plus",
  "constants": {
    "orange_stroke": 3,
    "metric_shadow": 3,
    "shadow_div": 30,
    "outline_stroke": 4
  },
  "screens": {
    "w200": {
      "w": 200,
      "h": 228,
      "layers": [
        {
          "id": "background",
          "kind": "graphics",
          "note": "redraw on theme/weather/bluetooth change",
          "items": [
            {
              "kind": "rect",
              "box": {
                "x": "w/10-orange_stroke+w/shadow_div",
                "y": "h/5-orange_stroke+w/shadow_div",
                "w": "(w*8)/10+2*orange_stroke",
                "h": "h/3+2*orange_stroke"
              },
              "fill": "$ink"
            },
            {
              "kind": "rect",
              "box": {
                "x": "w/10-orange_stroke",
                "y": "h/5-orange_stroke",
                "w": "(w*8)/10+2*orange_stroke",
                "h": "h/3+2*orange_stroke"
              },
              "fill": "$ink"
            },
            {
              "kind": "rect",
              "box": {
                "x": "w/10+orange_stroke",
                "y": "h/5+orange_stroke",
                "w": "(w*8)/10-2*orange_stroke",
                "h": "h/3-2*orange_stroke"
              },
              "fill": "$body"
            },
            {
              "kind": "polygon",
              "points": [
                [
                  100,
                  12
                ],
                [
                  190,
                  12
                ],
                [
                  190,
                  45
                ],
                [
                  187,
                  45
                ],
                [
                  187,
                  48
                ],
                [
                  184,
                  48
                ],
                [
                  184,
                  51
                ],
                [
                  181,
                  51
                ],
                [
                  181,
                  55
                ],
                [
                  175,
                  55
                ],
                [
                  175,
                  45
                ],
                [
                  175,
                  45
                ],
                [
                  100,
                  45
                ]
              ],
              "fill": "GColorWhite",
              "outline": {
                "stroke": "outline_stroke"
              }
            },
            {
              "kind": "polygon",
              "points": [
                [
                  100,
                  12
                ],
                [
                  10,
                  12
                ],
                [
                  10,
                  45
                ],
                [
                  13,
                  45
                ],
                [
                  13,
                  48
                ],
                [
                  16,
                  48
                ],
                [
                  16,
                  51
                ],
                [
                  19,
                  51
                ],
                [
                  19,
                  55
                ],
                [
                  25,
                  55
                ],
                [
                  25,
                  45
                ],
                [
                  25,
                  45
                ],
                [
                  100,
                  45
                ]
              ],
              "fill": {
                "cases": [
                  {
                    "when": {
                      "var": "theme.weather_condition_colors",
                      "op": "eq",
                      "value": false
                    },
                    "fill": "GColorWhite"
                  },
                  {
                    "when": {
                      "var": "weather_available",
                      "op": "eq",
                      "value": false
                    },
                    "fill": "GColorWhite"
                  },
                  {
                    "when": {
                      "var": "weather_code",
                      "op": "in",
                      "value": [
                        0,
                        1
                      ]
                    },
                    "fill": "GColorChromeYellow"
                  },
                  {
                    "when": {
                      "var": "weather_code",
                      "op": "in",
                      "value": [
                        2,
                        3,
                        45,
                        48
                      ]
                    },
                    "fill": "GColorLightGray"
                  },
                  {
                    "when": {
                      "var": "weather_code",
                      "op": "in",
                      "value": [
                        51,
                        53,
                        55,
                        56,
                        57,
                        61,
                        63,
                        65,
                        66,
                        67,
                        80,
                        81,
                        82
                      ]
                    },
                    "fill": "GColorBabyBlueEyes"
                  },
                  {
                    "when": {
                      "var": "weather_code",
                      "op": "in",
                      "value": [
                        95,
                        96,
                        99
                      ]
                    },
                    "fill": "GColorVividViolet"
                  }
                ],
                "default": "GColorWhite"
              },
              "outline": {
                "stroke": "outline_stroke"
              },
              "visibleWhen": {
                "any": [
                  {
                    "var": "weather_enabled",
                    "op": "eq",
                    "value": true
                  },
                  {
                    "var": "bt",
                    "op": "eq",
                    "value": false
                  }
                ]
              }
            },
            {
              "kind": "bitmap",
              "id": "bt",
              "center": [
                55,
                28
              ],
              "visibleWhen": {
                "var": "bt",
                "op": "eq",
                "value": false
              }
            }
          ]
        },
        {
          "id": "bars",
          "kind": "graphics",
          "note": "redraw on battery/step/theme/mode change",
          "items": [
            {
              "kind": "meterbar",
              "box": {
                "x": 22,
                "y": "h/5+h/3+orange_stroke+w/shadow_div+((h-(h/5+h/3+orange_stroke+w/shadow_div))-(2*32+8+metric_shadow))/2",
                "w": 155,
                "h": 32
              },
              "stroke": "orange_stroke",
              "shadow": {
                "dx": 2,
                "dy": "metric_shadow"
              },
              "frame": "$battery_frame",
              "core": "$ink",
              "value": "$battery",
              "fill": {
                "cases": [
                  {
                    "when": {
                      "var": "theme.battery_status",
                      "op": "eq",
                      "value": false
                    },
                    "fill": "$battery_bar"
                  },
                  {
                    "when": {
                      "var": "battery",
                      "op": "lt",
                      "value": 20
                    },
                    "fill": "$battery_low"
                  },
                  {
                    "when": {
                      "var": "battery",
                      "op": "lt",
                      "value": 50
                    },
                    "fill": "$battery_mid"
                  }
                ],
                "default": "$battery_high"
              },
              "inset": 3,
              "compact": {
                "maxH": 30,
                "stroke": 3,
                "inset": 2
              },
              "visibleWhen": {
                "var": "bars_mode",
                "op": "eq",
                "value": 0
              }
            },
            {
              "kind": "meterbar",
              "box": {
                "x": 22,
                "y": "(h/5+h/3+orange_stroke+w/shadow_div+((h-(h/5+h/3+orange_stroke+w/shadow_div))-(2*32+8+metric_shadow))/2)+32+8",
                "w": 155,
                "h": 32
              },
              "stroke": "orange_stroke",
              "shadow": {
                "dx": 2,
                "dy": "metric_shadow"
              },
              "frame": "$battery_frame",
              "core": "$ink",
              "value": "$steps",
              "fill": "$step_bar",
              "inset": 3,
              "compact": {
                "maxH": 30,
                "stroke": 3,
                "inset": 2
              },
              "visibleWhen": {
                "var": "bars_mode",
                "op": "eq",
                "value": 0
              }
            },
            {
              "kind": "meterbar",
              "box": {
                "x": 22,
                "y": "h/5+h/3+orange_stroke+w/shadow_div+((h-(h/5+h/3+orange_stroke+w/shadow_div))-(45+metric_shadow))/2",
                "w": 155,
                "h": 45
              },